{"format_version":"mstr.tokenizer-economics-corpus.v0","corpus_id":"B007-tokenizer-economics-v0","encoding":"UTF-8","newline":"LF","source_class":"REPOSITORY_AUTHORED_SYNTHETIC_FIXTURE","external_source_content":false,"claim_scope":"DETERMINISTIC_STRATIFIED_V0_FIXTURE_NOT_A_POPULATION_REPRESENTATIVE_SAMPLE","entries":[{"fixture_id":"python_b","category":"python","profile":"baseline","filename":"a.py","byte_count":78,"sha256":"ea2ccd98d09774a28783bcf55d63c7bac09ee61edc73a3a00913939d0818e70d","content_utf8":"def add_user_id(user_id: str, n: int = 1) -> str:\n    return f\"{user_id}:{n}\"\n"},{"fixture_id":"python_a","category":"python","profile":"adversarial","filename":"unicode.py","byte_count":129,"sha256":"b04e8930f61a6592764963612511bfef5216467ccffb881698640eba27b8ffb9","content_utf8":"def مجموع_2026(values):\n    long_identifier_name_2026=sum(values)\n    return \"مرحبا/世界\", long_identifier_name_2026\n"},{"fixture_id":"typescript_b","category":"typescript","profile":"baseline","filename":"a.ts","byte_count":91,"sha256":"39ee5312fc027dd93544262c3fbffd0fe0378ab20682a6fd011611bfc6cef57e","content_utf8":"export const parsePort=(v:string)=>{const n=Number(v);return Number.isInteger(n)?n:null;};\n"},{"fixture_id":"typescript_a","category":"typescript","profile":"adversarial","filename":"generic.ts","byte_count":100,"sha256":"89f870fd21a3d037d2665661bad9dc0c069b0ba65dc24a098a6d8caed428b382","content_utf8":"type Deep<T extends Record<string,unknown>>=Promise<Readonly<T[]>>; const label=`résultat:世界`;\n"},{"fixture_id":"javascript_b","category":"javascript","profile":"baseline","filename":"a.js","byte_count":92,"sha256":"90e495e6efae9396fe6e48eef8661ab7768a08b12b2ff1fe21711b2465b0351f","content_utf8":"export async function retry(op,n=3){for(let i=0;i<n;i++){try{return await op()}catch(e){}}}\n"},{"fixture_id":"javascript_a","category":"javascript","profile":"adversarial","filename":"regex.js","byte_count":78,"sha256":"bcb3b5cf79d4df3e43d857d880265d9fcf853ebf36dcc09faed1989b875aeb86","content_utf8":"const m=/^(?<scope>[a-z0-9_-]+)\\/(?<id>\\d+)$/u.exec(input??\"\"); // ✅ 世界\n"},{"fixture_id":"rust_b","category":"rust","profile":"baseline","filename":"a.rs","byte_count":96,"sha256":"09aac2d1ec14d4ed144431c9275681af61ae6c9416731833cf556df9bfabaa86","content_utf8":"fn pending(xs:&[Task])->Vec<&str>{xs.iter().filter(|x|!x.done).map(|x|x.id.as_str()).collect()}\n"},{"fixture_id":"rust_a","category":"rust","profile":"adversarial","filename":"generic.rs","byte_count":91,"sha256":"f77a803461fe890cf8ad95b8fe20f16c5ed4268bac2d0f2496e634365fe155a1","content_utf8":"fn normalize<'a,T:AsRef<str>+?Sized>(v:&'a T)->&'a str{v.as_ref()} // long_identifier_2026\n"},{"fixture_id":"go_b","category":"go","profile":"baseline","filename":"a.go","byte_count":98,"sha256":"f5400946008b725f37d52257e05a0f5509b705efe28c837fb9e9cf87e46f6526","content_utf8":"package q\nfunc Pop(xs []string)(string,[]string){if len(xs)==0{return \"\",xs};return xs[0],xs[1:]}\n"},{"fixture_id":"go_a","category":"go","profile":"adversarial","filename":"tags.go","byte_count":108,"sha256":"ccfd94b427ea5ffbdb5b2843e2fe325a63a79abab8eec6bc7859f933cd8ce2fa","content_utf8":"package q\ntype R struct{RequestIdentifier string `json:\"request_identifier\"`}\nvar Label=\"مرحبا/世界\"\n"},{"fixture_id":"java_b","category":"java","profile":"baseline","filename":"A.java","byte_count":99,"sha256":"eb191b80a65fa841e2df28d31c6dd4463deb33f10e02a59d44f525533dd99bc4","content_utf8":"final class A{static long sum(java.util.List<Integer>x){return x.stream().mapToLong(i->i).sum();}}\n"},{"fixture_id":"java_a","category":"java","profile":"adversarial","filename":"Generic.java","byte_count":122,"sha256":"2c8e1b6e94ff94e98d2d389b0dd301d9a3a9bb078e2fef268bcaee19289a5fdf","content_utf8":"interface X{java.util.concurrent.CompletableFuture<java.util.Map<String,java.util.List<Long>>> loadRequestIdentifiers();}\n"},{"fixture_id":"c_b","category":"c","profile":"baseline","filename":"a.c","byte_count":108,"sha256":"d8459d277921ebb75b9dc9a05245e824b3866850c707100020e06853a49e9d91","content_utf8":"#include <stddef.h>\nsize_t nz(const int*x,size_t n){size_t c=0;for(size_t i=0;i<n;i++)c+=x[i]!=0;return c;}\n"},{"fixture_id":"c_a","category":"c","profile":"adversarial","filename":"flags.c","byte_count":111,"sha256":"c0848984e662aec8e268ceedc31fc17346c0b17e4dc02adc361e3809de0fdedd","content_utf8":"#define SET(m,b)((m)|=(1u<<(b)))\nunsigned normalize_feature_flags_2026(unsigned v){SET(v,7);return v^0xA5A5u;}\n"},{"fixture_id":"cpp_b","category":"cpp","profile":"baseline","filename":"a.cpp","byte_count":101,"sha256":"06dea593977eb1f7579318f3b49e9c5c3228fcec026879f402d7a28a71ea15cc","content_utf8":"#include <optional>\nstd::optional<int> parse(int x){return x>=0?std::optional<int>{x}:std::nullopt;}\n"},{"fixture_id":"cpp_a","category":"cpp","profile":"adversarial","filename":"templ.cpp","byte_count":99,"sha256":"a978090f315c154a125f3bedf342f9740c1d47c5350359755709b1261d679adc","content_utf8":"template<class T,unsigned N> constexpr T first(T(&a)[N]){return a[0];} auto s=R\"(path\\x::世界)\";\n"},{"fixture_id":"sql_b","category":"sql","profile":"baseline","filename":"a.sql","byte_count":100,"sha256":"be4a548623f85c77b1a6c872f29a461c4cd45a0f9e8aeb11ad6c3587ff7b5157","content_utf8":"SELECT project_id,COUNT(*) AS n FROM tasks WHERE status='open' GROUP BY project_id ORDER BY n DESC;\n"},{"fixture_id":"sql_a","category":"sql","profile":"adversarial","filename":"window.sql","byte_count":134,"sha256":"10499ef1f5c9011a3dd369bdf876b80accbe3e6932ea400a43c45e3a653c4a1e","content_utf8":"WITH x AS(SELECT tenant_id,ROW_NUMBER()OVER(PARTITION BY tenant_id ORDER BY created_at DESC) rn FROM events)SELECT*FROM x WHERE rn=1;\n"},{"fixture_id":"shell_b","category":"shell","profile":"baseline","filename":"a.sh","byte_count":102,"sha256":"de11f13e09166480575a8dcb8e6ecf682060fba9ead30982c76ccbba88df674c","content_utf8":"#!/bin/sh\nset -eu\nfind \"${1:-.}\" -name '*.json' -print | while read -r f; do printf '%s\\n' \"$f\"; done\n"},{"fixture_id":"shell_a","category":"shell","profile":"adversarial","filename":"heredoc.sh","byte_count":85,"sha256":"57ffbb313fdbb81a883cdb896d5cc9dbfafce9c2f0651139b6f19a61498b81f5","content_utf8":"#!/bin/bash\nset -euo pipefail\ncat <<'JSON'\n{\"x\":\"$HOME\",\"u\":\"世界\",\"q\":\"a b\"}\nJSON\n"},{"fixture_id":"json_b","category":"json","profile":"baseline","filename":"a.json","byte_count":77,"sha256":"e3e574ed5365d04bdadbd1bba5fe0c1c33f58f0b4891551c10ccf04b5252481f","content_utf8":"{\"service\":\"builder\",\"features\":[\"lint\",\"test\"],\"network\":{\"enabled\":false}}\n"},{"fixture_id":"json_a","category":"json","profile":"adversarial","filename":"nested.json","byte_count":119,"sha256":"27baa433f844daa68a5a9ca4499ee5d47005c54db4efc336ae7e0ba849370b86","content_utf8":"{\"id\":\"req_00000000042\",\"labels\":{\"ar\":\"العربية\",\"zh\":\"世界\"},\"matrix\":[[1,2],[3,4]],\"escaped\":\"a\\nb\\t\\\"q\\\"\"}\n"},{"fixture_id":"yaml_b","category":"yaml","profile":"baseline","filename":"a.yaml","byte_count":66,"sha256":"fd1d3a6a12951bc12c7e6d1fba535babd168f79312c464163517afc3338d3e5e","content_utf8":"service: builder\nfeatures: [lint, test]\nnetwork:\n  enabled: false\n"},{"fixture_id":"yaml_a","category":"yaml","profile":"adversarial","filename":"advanced.yaml","byte_count":110,"sha256":"d18ce62266f6fdd4f7c9859e23e0676f739dc04334eb89d926461567a2b12cf7","content_utf8":"defaults: &d {retries: 3}\nservice:\n  <<: *d\n  command: |\n    echo 世界\n  note: >\n    مرحبا folded text\n"},{"fixture_id":"toml_b","category":"toml","profile":"baseline","filename":"a.toml","byte_count":67,"sha256":"60f82b7b11f7c97ca26c8d749b4fe04671293701f51cc55bd792facc34361dec","content_utf8":"service=\"builder\"\nfeatures=[\"lint\",\"test\"]\n[network]\nenabled=false\n"},{"fixture_id":"toml_a","category":"toml","profile":"adversarial","filename":"advanced.toml","byte_count":102,"sha256":"3dfb542cbc13f087573e62ef27892c2a709f4a8fd1ea0d07a59eafb61d9be5d9","content_utf8":"title=\"Tokenizer 世界\"\nports=[8000,8001]\nreleased=2026-08-27T07:00:00Z\n[[replica]]\nname=\"eu-west-1\"\n"},{"fixture_id":"diff_b","category":"diff","profile":"baseline","filename":"a.diff","byte_count":61,"sha256":"99fb64be281ab1d4baa76b8010ede65dc6aa120ab5d6c6f076bd4d280a82f565","content_utf8":"diff --git a/a.py b/a.py\n@@ -1 +1 @@\n-return a-b\n+return a+b\n"},{"fixture_id":"diff_a","category":"diff","profile":"adversarial","filename":"complex.diff","byte_count":164,"sha256":"2ffcde79d88b683be4465e4dcf61ee5edad6d7a0ecbac7c9c789cb07758ddd6b","content_utf8":"diff --git a/old.txt b/new.txt\nsimilarity index 92%\nrename from old.txt\nrename to new.txt\n@@ -1 +1 @@\n-old\n+new 世界\nBinary files /dev/null and b/logo.bin differ\n"},{"fixture_id":"stack_trace_b","category":"stack_trace","profile":"baseline","filename":"py.txt","byte_count":116,"sha256":"6a809eabe2c352ae52e730f3dc1f9b6e11756cff27f4d412da3cdaf03e3e54d8","content_utf8":"Traceback (most recent call last):\n  File \"/w/app.py\", line 9, in run\n    load()\nValueError: missing field: service\n"},{"fixture_id":"stack_trace_a","category":"stack_trace","profile":"adversarial","filename":"node.txt","byte_count":145,"sha256":"f429f9a27031fade96bfc705bc06918ea4106e99f7b1297af3ac6ba6bbb9ff04","content_utf8":"TypeError: undefined status\n    at parse (/w/client.ts:118:27)\n    at async retry (/w/retry.ts:44:16)\nCaused by: Error 502 — بوابة/世界\n"},{"fixture_id":"file_paths_b","category":"file_paths","profile":"baseline","filename":"paths.txt","byte_count":105,"sha256":"33ed734a2970620804809386ce3efaeddac7f43ef3cc270b7f8330f39763aca0","content_utf8":"src/mstr_qualify/cli.py\ntests/contract/test_x.py\npackages/web/src/TaskCard.tsx\nCargo.toml\nCMakeLists.txt\n"},{"fixture_id":"file_paths_a","category":"file_paths","profile":"adversarial","filename":"paths2.txt","byte_count":158,"sha256":"9f028a23b9cf6e25dbf035ce6676190da7eea99e8efa66f6f06ceb4f3430f83a","content_utf8":"C:\\Users\\builder\\cache\\tokenizer.json\npackages/mobile app/src